Grant Name,Grant Number,County,Persons (entities),Year,Land Size (Acres),Land Size (Sq. Leagues),Coordinates,Notes
NIGUEL,501,Orange,"Alvar, ##ado, Juan, Conce, ##cion Avila, Juan, Conce, ##cion Avila, Miguel",,316.01,3,"In T 7S, R 8W, SBM",
SAN DIEGUITO,523,San Diego,"Victoria, Silva, Gutierrez, Alvar, ##ado, Pico, Juan Osun, Juliana L. Osuna",,,,,
LOMPOC,374,Santa Barbara,"Alvar, ##ado, Joaquin Carrillo, Jose Antonio Camilo, J, J, A, Carrillo",,38.000,,,
LOS GUILLICOS,66,Sonoma,"Alvar, ##ado, John Wilson, Juan Wilson",,18.833,,,
LOMAS DE LA PURIFICACION,366,Santa Barbara,"Micheltore, A, ##gus, ##tin Janssens, A, ##gus, ##tin Janssens",,,3,"In T 5-6N, R
   30W, SBM",
ISLAND OF SANTA ROSA,405,Santa Barbara,"Micheltore, Antonio, Carlos Carrillo, Manuela Carrillo de Jones",,696.49,,,
BOLSA DE SAN CAYETANO,221,Monterey,"de Sola, Ignacio Vallejo, Dolores Pico, Arguello, Ignacio Vallejo, Figueroa, Jose de Jesus Vallejo, Ignacio, J, de J, Vallejo",,866.43,2,"In T
   12S, R2E, MDM",
PUNTA DE LA CONCEPCION,375,Santa Barbara,"Alvar, ##ado, Anasta, ##cio Carrillo, A, Carrillo",,992.04,6,"In T 5-6N, R 34-35W,
   SBM",
CAP AY,8,,"Micheltore, Josef, ##a Soto, Josefa Soto",,388.17,10,"In T 21-23N, R 1-3W, MDM",
CANADA DE SAN MIGUELITO,391,Ventura,"Pi, ##co, Ramon Rodriguez",,877.04,2,"In T 3N, R 23-
  24W.",
SAN LUISITO,327,San Luis Obispo,"Alvar, ##ado",,369.56,,,
PIEDRA BLANCA,321,San Luis Obispo,"Alvar, ##ado, Jose de Jesus Pico, Jose de Jesus Pico",,805.59,,"In T 25-26S, R 6-8E, MDM",
PINOLE,126,Contra Costa,"Echeand, ##ia, Alvar, ##ado, Ygna, ##cio Martinez, Maria Antonio Martinez de Richardson",,"17,760",4,"In T 1-2N, R 3-4W, MDM",
LA NACION,528,San Diego,"Pi, ##co, Juan Forster, Juan Forster",,631.94,6,,
LAS SALINAS,257,Monterey,"Antonio Aceves, Antonio Romero, Gutierrez, Gabriel Espinosa, Linda E. Pogue, G, Espinosa",,413.81,4,"In T 14S, R 2E.",
PUNTA DE LA LAGUNA,354,,"Micheltore, Luis Arellanes, Emeli, ##o Miguel Ortega, Luis Arellanes",,648.42,6,,
SAN MATEO,149,San Mateo,"Pi, ##co, C, ##ay, Arena, W, Howard",,538.80,2,,
CHUALAR,270,Monterey,"Manuel Jimeno, Casa, Juan Malari, M, Malari",,889.68,2,,
SAN JOSE Y SER CHIQUITO,552,Monterey,"Alvar, ##ado, Marcel, ##ino Escobar, Joseph S. Emory, Nathan W. Spaulding, A, ##bner Bassett, Mary Ann Bassett",,,2,,
ESTERO AMERICANO,28,Sonoma,"Manuel Jimeno, Casa, Edward McI, ##sh, Jasper",,"8,829",,"In T 5-6N, R 10W.",
LOS CERRITOS,467,Los Angeles,"Fages, Don, Manuel Nieto, Figueroa, Manuel Nieto, Don, ##a Manuela Nieto, Manuel Nieto, Figueroa, Juan Temple",,054.36,,"In T 3-4S, R 12-13W, SBM",
LOS MEDANOS,111,Contra Costa,"Alvar, ##ado, Jose Antonio Mesa, Jose Miguel Mesa, J, D, Stevenson",,658.83,,,
EL CONEJO,408,,"Arrillaga, Ignacio Rodriguez, Arrillaga, Jose Polanco, de Sola, Jose de la Guerra y Noriega, Rodriguez, Figueroa, Maria del Carmen Rodriguez, Alvar, ##ado, Jose de la Guerra y Nor, Jose de la Guerra y Nor",,671.56,11,"In T 1-2N, R 19-20W, SBM",
LA GOLETA,382,Santa Barbara,"Pi, ##co, Daniel Hill, Daniel Hill",,426.10,,,
ROBLAR DE LA MISERIA,50,Sonoma,"Pi, ##co, Juan Nepom, ##no Padillo, Daniel Wright",,"1,792",,"In T 4-6N,
  R 7-8W, MDM",
CANADA DE LOS NOGALES,546,Los Angeles,"Micheltore, Jose M. Aguilar, J, M. Aguilar",,199.56,,,
CANADA DE SALISPUEDES,377,Santa Barbara,"Micheltore, Pedro Cordero, John Keyes",,651.21,,"In T 6N, R 33-34W, SBM",
PANOCHE DE SAN JUAN Y LOS CARRISALITOS,235,Merced,"Micheltore, Julian Ursua",,175.34,5,"In T
  11-13S, R 9-10E, MDM",
NICASIO,32,Marin,"Micheltore, Pablo de la Guerra, Juan Cooper, H, W, Halle, W, Reynolds, Daniel Frink, James Black, B, R, Buckelo",,848.85,16,"In T 2-5N, R6-10W.",
LOS MEGANOS,110,Contra Costa,"Castro, Jose Noriega, Nor, John Marsh, Alice Marsh, John Marsh",,"13,316",,,
RINCON DE LA PUENTE DEL MONTE,272,Monterey,"Gutierrez, Figue, ##roa, Teod, ##oro Gonzales, Teodoro Gonzales",,218.62,7,"In T 16S, R 5E.",
SAUCITO,277,Monterey,"Figueroa, Grac, ##iano Manjares, John Wilson, Josiah Swain, George C. Harris",,211.65,,,
BOLSA DE CHAMISAL,352,San Luis Obispo,"Alvarado, Francisco Qui, Lewis T, Burton",,335.22,3,,
HUERTA DE CUATI,421,Los Angeles,"Victoria Reid, Alvarado, Victoria Reid",,128.26,,,
N2,20,,"Alvarado, John A. Sutter, John A. Sutter",,839.30,11,,
LA HABRA,462,,"Manuel Jimeno, Casa, Don Mariano Rolden, Andreas Pico",,698.57,,"In T
  2-3S,R 10-11W, SBM",
EL SUR,288,Monterey,"Figue, Juan B. Alvarado, J, B, R. Cooper",,989.06,2,,
SANTA ANA DEL CHINO,477,San Bernardino,"Alvar, ##ado, Antonio M. Lu, Maria Merced Williams, Francisca Williams, Isaac Williams",,234.20,5,,
NIPOMO,351,,"Alvarado, William G. Dana, William G. Dana",,887.91,11,,
CANADA DE HERRERA,40,Marin,"Manuel Jimeno, Casa, Domingo Sais, Domingo Sais",,659.45,,,
TRABUCO,497,Orange,"Pie, ##o, J, Forster, Santiago Arguel, Juan Forster",,184.47,5,,
ARROYO DE LA ALAMEDA,133,Alameda,"Alvar, ##ado, Jose de Jesus Vallejo, J, . de J. Vallejo",,705.38,4,"In T 3-4S, R 1-2W, MDM",
SAN JUAN,97,Sacramento,"Micheltore, Joel P. Dedmond, Hi, ##ram Grimes",,982.70,2,,
BOCA DE SANTA MONICA,539,Los Angeles,"E, ##and, Xavier Alvarado, Antonio Machado, Manuel Jimeno, Casa, Alvarado, Francisco Marques, Y, Reyes, Reyes",,635.93,,,
POSOLMI,145,Santa Clara,"Micheltore, Robert Walkinshaw, Thomas Campbell",,695.90,,"In T
   6S, R 2W, MDM",
